{
  "schemaVersion": "1.1",
  "tool": {
    "name": "AzL Beacon",
    "version": "1.1.0",
    "releaseTrain": "12.2609 (latest)"
  },
  "runId": "00000000-0000-0000-0000-0000000000aa",
  "startedUtc": "2026-10-15T14:00:05Z",
  "finishedUtc": "2026-10-15T14:03:41Z",
  "durationSeconds": 216.0,
  "redacted": false,
  "node": {
    "hostname": "MININT-EXAMPLE",
    "serialNumber": "EXAMPLE0001",
    "smbiosUuid": "00000000-0000-0000-0000-000000000001",
    "manufacturer": "Example Vendor",
    "model": "Example AX Node"
  },
  "context": {
    "region": "eastus",
    "regionRequested": "East US",
    "oem": "dell",
    "arcGatewayMode": false,
    "proxyConfigured": false,
    "categories": [
      1,
      2,
      3,
      4,
      5,
      6
    ],
    "endpointSource": "https://github.com/Azure/AzureStack-Tools/blob/master/HCI/EastUSendpoints/eastus-hci-endpoints.md"
  },
  "summary": {
    "total": 25,
    "pass": 15,
    "fail": 1,
    "warn": 4,
    "skip": 5,
    "verdict": "FAIL"
  },
  "results": [
    {
      "category": "Cat-1-Network",
      "name": "NIC-Up-WithIP",
      "target": "adapter",
      "status": "Pass",
      "severity": "",
      "detail": "Example NIC 25GbE / 192.0.2.21",
      "durationMs": 0,
      "remediation": "",
      "source": ""
    },
    {
      "category": "Cat-1-Network",
      "name": "Gateway-Ping",
      "target": "192.0.2.1",
      "status": "Pass",
      "severity": "",
      "detail": "1ms",
      "durationMs": 4,
      "remediation": "",
      "source": "https://learn.microsoft.com/azure/azure-local/concepts/firewall-requirements"
    },
    {
      "category": "Cat-1-Network",
      "name": "MgmtSubnet-Node1-Ping",
      "target": "192.0.2.21",
      "status": "Pass",
      "severity": "",
      "detail": "0ms",
      "durationMs": 2,
      "remediation": "",
      "source": ""
    },
    {
      "category": "Cat-1-Network",
      "name": "NTP-192.0.2.10",
      "target": "192.0.2.10:123/udp",
      "status": "Pass",
      "severity": "",
      "detail": "UDP/123 answered; clock offset 1.4s vs server",
      "durationMs": 31,
      "remediation": "",
      "source": "https://learn.microsoft.com/azure/azure-local/concepts/firewall-requirements"
    },
    {
      "category": "Cat-2-DNS",
      "name": "DNS-TCP53-192.0.2.10",
      "target": "192.0.2.10:53",
      "status": "Pass",
      "severity": "",
      "detail": "2ms",
      "durationMs": 2,
      "remediation": "",
      "source": ""
    },
    {
      "category": "Cat-2-DNS",
      "name": "DNS-Forward-management.azure.com",
      "target": "management.azure.com",
      "status": "Pass",
      "severity": "",
      "detail": "20.50.2.10",
      "durationMs": 18,
      "remediation": "",
      "source": ""
    },
    {
      "category": "Cat-2-DNS",
      "name": "DNS-Forward-node-02.corp.contoso.com",
      "target": "node-02.corp.contoso.com",
      "status": "Warn",
      "severity": "",
      "detail": "Expected before deployment: No such host is known",
      "durationMs": 12,
      "remediation": "",
      "source": ""
    },
    {
      "category": "Cat-3-AD",
      "name": "AD-LDAP-192.0.2.10",
      "target": "192.0.2.10:389",
      "status": "Pass",
      "severity": "",
      "detail": "1ms",
      "durationMs": 1,
      "remediation": "",
      "source": "https://learn.microsoft.com/azure/azure-local/concepts/firewall-requirements#active-directory"
    },
    {
      "category": "Cat-3-AD",
      "name": "AD-ADWS-192.0.2.10",
      "target": "192.0.2.10:9389",
      "status": "Fail",
      "severity": "critical",
      "detail": "Timeout",
      "durationMs": 5003,
      "remediation": "Allow TCP/9389 from the nodes to the domain controller (ADWS).",
      "source": "https://learn.microsoft.com/azure/azure-local/concepts/firewall-requirements#active-directory"
    },
    {
      "category": "Cat-3-AD",
      "name": "AD-Kerberos-UDP-192.0.2.10",
      "target": "192.0.2.10:88/udp",
      "status": "Skip",
      "severity": "",
      "detail": "UDP cannot prove open: no reply and no ICMP unreachable (open or filtered)",
      "durationMs": 0,
      "remediation": "",
      "source": "https://learn.microsoft.com/azure/azure-local/concepts/firewall-requirements#active-directory"
    },
    {
      "category": "Cat-3-AD",
      "name": "AD-RPC-Dynamic-49152-65535",
      "target": "tcp 49152-65535",
      "status": "Skip",
      "severity": "",
      "detail": "Not scanned: the RPC dynamic range is too large to probe; verify the firewall rule 49152-65535/TCP from the nodes to the DCs.",
      "durationMs": 0,
      "remediation": "",
      "source": "https://learn.microsoft.com/azure/azure-local/concepts/firewall-requirements#active-directory"
    },
    {
      "category": "Cat-3-AD",
      "name": "AD-SRV-DCLocator",
      "target": "_ldap._tcp.dc._msdcs.corp.contoso.com",
      "status": "Pass",
      "severity": "",
      "detail": "SRV records: 2",
      "durationMs": 0,
      "remediation": "",
      "source": ""
    },
    {
      "category": "Cat-4-Endpoints",
      "name": "Endpoint-Region",
      "target": "eastus",
      "status": "Pass",
      "severity": "",
      "detail": "List updated November 27th, 2025; 83 entries",
      "durationMs": 0,
      "remediation": "",
      "source": "https://github.com/Azure/AzureStack-Tools/blob/master/HCI/EastUSendpoints/eastus-hci-endpoints.md"
    },
    {
      "category": "Cat-4-Endpoints",
      "name": "EP-management.azure.com",
      "target": "management.azure.com:443",
      "status": "Pass",
      "severity": "critical",
      "detail": "TCP+HTTPS ok -- 21ms",
      "durationMs": 21,
      "remediation": "",
      "source": "https://github.com/Azure/AzureStack-Tools/blob/master/HCI/EastUSendpoints/eastus-hci-endpoints.md"
    },
    {
      "category": "Cat-4-Endpoints",
      "name": "EP-login.microsoftonline.com",
      "target": "login.microsoftonline.com:443",
      "status": "Pass",
      "severity": "critical",
      "detail": "TCP+HTTPS ok -- 19ms",
      "durationMs": 19,
      "remediation": "",
      "source": "https://github.com/Azure/AzureStack-Tools/blob/master/HCI/EastUSendpoints/eastus-hci-endpoints.md"
    },
    {
      "category": "Cat-4-Endpoints",
      "name": "EP-gbl.his.arc.azure.com",
      "target": "gbl.his.arc.azure.com:443",
      "status": "Pass",
      "severity": "critical",
      "detail": "TCP+HTTPS ok -- 30ms",
      "durationMs": 30,
      "remediation": "",
      "source": "https://github.com/Azure/AzureStack-Tools/blob/master/HCI/EastUSendpoints/eastus-hci-endpoints.md"
    },
    {
      "category": "Cat-4-Endpoints",
      "name": "EP-eastus.obo.arc.azure.com",
      "target": "eastus.obo.arc.azure.com:8084",
      "status": "Skip",
      "severity": "informational",
      "detail": "Port 8084 is a cluster-internal service port, not an outbound probe target",
      "durationMs": 0,
      "remediation": "",
      "source": "https://github.com/Azure/AzureStack-Tools/blob/master/HCI/EastUSendpoints/eastus-hci-endpoints.md"
    },
    {
      "category": "Cat-4-Endpoints",
      "name": "EP-crl3.digicert.com",
      "target": "crl3.digicert.com:80",
      "status": "Warn",
      "severity": "warning",
      "detail": "Timeout",
      "durationMs": 5002,
      "remediation": "Allow outbound HTTP 80 to crl3.digicert.com (Azure Local benefits); HTTPS inspection must be off for these names.",
      "source": "https://github.com/Azure/AzureStack-Tools/blob/master/HCI/EastUSendpoints/eastus-hci-endpoints.md"
    },
    {
      "category": "Cat-4-Endpoints",
      "name": "PublicIP-gbl.his.arc.azure.com",
      "target": "gbl.his.arc.azure.com",
      "status": "Pass",
      "severity": "",
      "detail": "Public: 20.50.2.20",
      "durationMs": 0,
      "remediation": "",
      "source": "https://learn.microsoft.com/azure/azure-local/concepts/firewall-requirements"
    },
    {
      "category": "Cat-4-Endpoints",
      "name": "TlsInspection-login.microsoftonline.com",
      "target": "login.microsoftonline.com:443",
      "status": "Pass",
      "severity": "",
      "detail": "Microsoft chain (chain contains Microsoft Azure RSA TLS Issuing CA)",
      "durationMs": 0,
      "remediation": "",
      "source": "https://learn.microsoft.com/azure/azure-local/concepts/firewall-requirements"
    },
    {
      "category": "Cat-5-EnvChecker",
      "name": "EnvChecker-Module",
      "target": "AzStackHci.EnvironmentChecker",
      "status": "Pass",
      "severity": "",
      "detail": "Loaded 10.2605.0.2006 from X:\\Tools\\Modules\\AzStackHci.EnvironmentChecker\\10.2605.0.2006\\AzStackHci.EnvironmentChecker.psd1",
      "durationMs": 0,
      "remediation": "",
      "source": ""
    },
    {
      "category": "Cat-5-EnvChecker",
      "name": "EnvChecker-Connectivity",
      "target": "Invoke-AzStackHciConnectivityValidation",
      "status": "Warn",
      "severity": "",
      "detail": "41/42 checks succeeded; 1 itemised below",
      "durationMs": 61000,
      "remediation": "",
      "source": ""
    },
    {
      "category": "Cat-5-EnvChecker",
      "name": "Connectivity-AzStackHci_Connectivity_Observability_crl",
      "target": "crl.microsoft.com",
      "status": "Warn",
      "severity": "warning",
      "detail": "Could not reach the endpoint",
      "durationMs": 0,
      "remediation": "https://aka.ms/hci-envch",
      "source": "AzStackHci.EnvironmentChecker"
    },
    {
      "category": "Cat-5-EnvChecker",
      "name": "EnvChecker-Network",
      "target": "Invoke-AzStackHciNetworkValidation",
      "status": "Skip",
      "severity": "",
      "detail": "Skipped: config is missing: infraIpPools, hostNetworkIntents. The validator needs the intent, IP pool and management subnet plus a session to each node.",
      "durationMs": 0,
      "remediation": "",
      "source": ""
    },
    {
      "category": "Cat-6-Arc",
      "name": "Arc-Readiness",
      "target": "arc",
      "status": "Skip",